,Finding,Cause,Implication,Recommendation
0,Auditor’s Remarks Evidences in form of photos showing the corrections made should have been attached., , , 
1,"(b) Assessment of the utilisation of the infrastructure (i) Observed functionality and usage At the time of audit inspection, the division office block was already functioning and had been put to its intended use.", ,OK,OK
2,"(c) Assessment of the fulfilment of environmental and social impact requirements, health and safety Environmental and Social Impact Safeguards, health and safety requirements and actions (i) At the time of audit, the works were complete. Reports were not available regarding compliance to Environmental, social, health and safety requirements during project implementation.",Poor project management.,Degradation of the environment.,"The Municipality should ensure that Environmental and Social Impact Safeguards, health and safety requirements are fully implemented during the project."
3,Management Response Trees were planted by the contractor but the documents could not be avail to audit for verification as they got loss. Attached is the police report. Auditor’s Remarks Evidences in form of photos showing the planted the trees should have been attached., , , 
4,(i) of key audit recommendations (d) Assessment of the extent of O&M for completed facilities Percentage implemented Not applicable since the project had not been audited before., , , 
5,activities (ii) Evidence of planning and budgeting for O&M The O&M plan was not availed to the audit team., , ,The municipality should ensure that it considers operation and maintenance activities in its planning and budgeting .
