,Objective,Sub objective Project Finding Assessment parameters,Unnamed: 2,Unnamed: 3,Unnamed: 4,Score,%age score
0,URINAL AT PUGWINYI HEALTH CENTRE II PATIKO SUB COUNTY.,Specifications  No tests were done due to lack of in-situ testing equipment. Marks frozen  No defects were observed.,drawings and physical specifications (4 out of 4)  Conformity of audit test results to specifications (NA)  Presence of defects from visual observations (5 out of 5), , , , 
1,CONSTRUCTION OF PLACENTA PIT AT OITINO HC II," No tests done and no record on file  Generally, conforms to Specifications  No tests were done due to lack of in-situ testing equipment. Marks frozen  Minor defects were observed.", Material test results on file (0 out of 1)  Conformity of site works to design drawings and physical specifications (4 out of 4)  Conformity of audit test results to specifications (NA)  Presence of defects from visual observations (5 out of 5),9,90.0, , 
2,Sub total 45 out of 50, , ,45,90.0, , 
3,Utilisation of infrastructure,RENOVATION OF A THEATER AT AWACH HEALTH CENTRE IV, The facility is being fully utilised.  The guide for the parameters to form a basis for scoring are lacking in the data template. Marks frozen, Functioning and in use as intended (6 out of 6)  Influence of the infrastructure on decision to bring children to school (NA),6.0,100.0, 
4, ,CONSTRUCTION OF 4 STANCES LINED VIP LATRINE WITH A SHOWER AT AWACH HCIV, The pit latrine is being fully utilised.  The guide for the parameters to form a basis for scoring are lacking in the data template. Marks frozen, Functioning and in use as intended (6 out of 6)  Influence of the infrastructure on decision to bring children to school (NA),6.0,100.0, 
5, ,CONSTRUCTION OF 4 STANCES LINED VIP LATRINE WITH A URINAL AT BINYA HCII,The pit latrine is being fully utilised.  The guide for the parameters to form a basis for scoring are lacking in the data template. Marks frozen, Functioning and in use as intended (6 out of 6)  Influence of the infrastructure on decision to bring children to school (NA),6.0,100.0, 
