,Procurement Reference/ Project Title,Timeliness in procurement (Time taken against procurement plan),Unnamed: 2,Unnamed: 3,Percentage of Compliance to Procurement Procedures,Unnamed: 5,Comparison of contract price with the budget,Unnamed: 7,Unnamed: 8,Unnamed: 9
0, ,Planned Time (Days),Actual time taken (Days),Score/5,%,Score/5,Budget,Contract Price,%,Score/5
1,GULU508/WRKS/2016-2017/000028 Construction of a Four-Stance VIP Latrine with a Urinal at Binya HCII at Odek II,No data,No data,0,0,0,No data,No data,-,0
2,GULU508/WRKS/2016-2017/00027 Construction of Placenta Pit at Oitino HCII In Bungatira S/C,No data,No data,0,0,0,No data,No data,-,0
3,GULU508/WRKS/2014-2015/00004 Completion of renovation of a theatre at Awach HCIV in the FY 2016/17,4years,-,0,0,0,No budget provided,"65,204,450",-,0
4,GULU508/WRKS/2015-2016/000020 Construction of a four-stance VIP latrine with a urinal at Awach HCIV at Awach S/C,112 days,112,5,0,5,"13,830,000","13,000,000",6,5
5,GULU508/WRKS/2017-2018/00021 Construction of a Two-Stance Latrine with Urinal at Pugwinyi HCII,No data,No data,0,0,0,"9,000,000","7,410,400",18,0
6,Total Score, , ,5, ,5, , , ,5
