,Unnamed: 0,"Maintenance and renovations in Usafi, Wandegeya and Nakawa Markets Support urban fish farming and management of fisheries resources",Yes,3,Unnamed: 4,Unnamed: 5,Unnamed: 6,Unnamed: 7,"-Works on Kasubi Completed, and resettlement of vendors to start FY 2020/21 -Construction works for Busega Market to be completed during FY2020/21 -Phase 1 of Kitintale market to be concluded in Quarter 1 FY 2020/21 (September 2020",3.1,Not implemented,No monitoring reports were prepared,No. Management implemented different activities,Unnamed: 13,Unnamed: 14
0,"02 04 Urban Plannin g, Securit y and Land Use",09 Physical Planning,"Output: 01 Urban planning, policies, laws and strategies","Retooling of Directorate Operating departments (, Architectural Design unit, Survey Unit, Total station.",No,N/a,"1,137,927","1,137,926","1,137,926","1,103,83 3",Activity was affected by COVID-19 -19,N/a,Not quantified,No monitoring reports were prepared,No. Outputs were not appropriately quantified
1, , , ,DPP Staff- Specialized Trainings.,No,N/a, , , , ,Trained all ward administrators to use survey 123 ArcGIS application to map out Boda Boda stages in the City.,N/a,Not quantified,No monitoring reports were prepared,No. Outputs were not appropriately quantified
2, , , ,DPP- Assorted Landscaping tools,No,N/a, , , , ,Conducted a vulnerability study in the Greater Kampala Metropolitan Area (GKMA) and published findings in KCCA COVID-19 Web Hub,N/a,Not quantified,No monitoring reports were prepared,No. Outputs were not appropriately quantified
3, , , ,DPP- Information dissemination on products of DPP.,No,N/a, , , , ,"Produced 578 tree seedlings Greening and Beautification -Greened 37,432m2 (approx. 9.24 acres) in the city Capacity Development",N/a,Not quantified,No monitoring reports were prepared,No. Outputs were not appropriately quantified
4, , , ,DPP Land Scaping - Conduct,No,N/a, , , , ,Conducted GPS mapping training for a staff from Agopa Consulting firm to map out selected sites within the City for construction of Primary Sanitary Facilities.,N/a,Not quantified,No monitoring reports were prepared,No. Outputs were not appropriately quantified
