,Unnamed: 0,"Output: 41 Policy, Planning and Legal Services",Continue the Citizen engagements and partnership programs,Yes,1,"1,568,918","44,408,50 1","9,349,748","9,107,31 2",Conducted engagements with stakeholders about Local Service Tax Module,0,Fully implemented,No monitoring reports were prepared,Yes.1
0,Provide effective oversight on the implementation of the KIIDP 2 activities., ,Yes,1, , , , , , ,Reviewed implementation of risk mitigation strategies and updated KIIDP risk profile,0,Fully implemented,No monitoring reports were prepared
1,"Increase outreach, public engagement and client services by utilizing different media including SMS, social media, radio and TV", ,No,N/a, , , , , , ,Conducted engagements with stakeholders about Local Service Tax Module -Engaged consultants on improving Trading license module,N/a,Not quantified,No monitoring reports were prepared
2,Increase internal capacity to provide in-house coverage of all official functions of the Authority;, ,Yes,1, , , , , , ,"-Reviewed current processes in line with KCCA Assets Management and drafted a URS document for the Re- Engineered Asset Management System -Documented a Draft Business Case for the Project Management System, and this has been shared with the Lead BPR for review",0,Fully implemented,No monitoring reports were prepared
3,Organize prepare and submit the Budget Framework Paper and Budget Estimates for Financial Year 2020/21;, ,Yes,1, , , , , , ,"Prepared 3rd Quarterly Performance Report FY 2019/20 and submitted to the Ministry of Finance, Planning and Economic Development.",0,Fully implemented,No monitoring reports were prepared
4,Continue implementing of Kampala Climate Change Action Plan, ,Yes,1, , , , , , ,"-Coordinated internal and external stakeholder validation engagements for the Disaster Risk and Climate Change Resilience Strategy, as well as the Emergency Preparedness and Response plan for Kampala.",0,Fully implemented,No monitoring reports were prepared
