,Unnamed: 0,SN .,Beneficia ry,Deduct ion code,Payroll Deduction amount (UGX),Unnamed: 5,Amount remitted as per IFMS (UGX),Unnamed: 7,at,Unnamed: 9
0, , , , , , , ,remittanc e (UGX) Under, , 
1, ,1,Uganda Revenue Authority Collections,249.0,"1,498,987,622", ,"1,447,620,813","51,366,809", , 
2, ,2,Uganda National Teachers Union (Unatu),257.0,"15,514,560", ,"15,339,815","174,745", , 
3, ,3,Uganda Consumer Lenders/ Uganda Bankers Associatio n,482.0,"317,931,647", ,"295,823,993","22,107,654", , 
4, ,Total, , ,"1,832,433,829", ,"1,758,784,621","73,649,208", , 
5, ,"Under remittances could lead to misappropriations of funds not paid to the beneficiaries Additionally, Over remittance of funds could lead to loss of District funds. Accounting Officer attributed under remmittance to the following;  The challenge of the IFMS network which duplicates and at times hides payments after they are validated and then returns them at the closure of Financial year as unpaid.  A result of non remittance of deductions on suspended salary for staff under disciplinary proceedures. The", , , , , , , , 
6,"ii) Un-authorized loans deductions Section 2.1.2 & 2.1.4 of the service agreement between the Government Uganda Lenders' Association/Uganda Bankers' Association letter of undertaking for each Government employee before making an employee reservation on the PDMS. Consumer requires a (MoPS) and addition, only deductions consented to by employees, in writing, should be submitted to the MoPS for timely monthly payroll processing or as advised by the employer. Lack of letters of undertaking I noted that the District made unauthorised loan deductions totalling UGX.100,753,524 . The deductions were from 57 employees that did not have letters of undertaking, as shown in Appendix 4(a). is a risk of making deductions from staff that have no loans, which deprives them of their earnings. Accounting Officer explained that this was due to the fact that Financial Institutions offer loans to employees using phones, where management has no control, since an employee receives money before being approved on the PCA. Additionally, financial institutions offer Topup loans without signing new Letters of undertaking. In a) There The", , , , , , , , ,"I advised the Accounting Officer to ensure that all loan applications are backed by letters of undertaking as well as letters of consent by the applicants. the Accounting Officer should liaise with responsible officers to ensure that loans are approved through the PDMS. Additionally,"
7, , , , , , , , , , 
8, , , , , , , , , , 
