,Unnamed: 0,Unnamed: 1,Unnamed: 2,Unnamed: 3,Unnamed: 4,Unnamed: 5,Unnamed: 6,Unnamed: 7,Unnamed: 8,Unnamed: 9,Unnamed: 10,Unnamed: 11,Unnamed: 12
0, ,088180 Health Centre Constru ction and Rehabili tation,YES,Partial construction of standard OPD at Lapeta HC II phase 1,"65,000","65,000","65,000","64,421",Partial construction of standard OPD at Lapeta HC II phase 1 done,0.0,Fully implemented;,No M&E report,Quarter 4 report not availed.
1,Roads and Engineering, , , ,0,0,0,0, , , , , 
2,"0481 District, Urban and Commun ity Access Roads",Mainte nance of Distric t roads,YES,Routine mechanised maintainance- 42.5km,"774,25 4","774,254","455,605","318,649",-33.4 km of district roads Routinely Mechanised,9.1,Partially implemented;,No M&E report,Quarter 4 report not availed.
3, , , ,-Manual Maintenance 378.3km District roads of of, , , , ,-378.3km of District roads manual maintened for 2 months,0.0,Partially implemented;,No M&E report,Quarter 4 report not availed.
4, , , ,equipment maintained and servced Roads, , , , ,Roads equipment maintained and servced, ,Partially implemented;,No M&E report,Quarter 4 report not availed.
5, ,Road constr uction and rehabil,YES,Rehabilitation of 3.3 km Gulu PTC- Kidere road,"126,94 0","126,940","121,788","5,152",3.3 km Gulu PTC- Kidere road rehabilitated,0.0,Fully implemented;,No M&E report,Quarter 4 report not availed.
